{
  "schema_version": "1.0.0",
  "event_id": "evt-codex-appr-1003",
  "sequence": 5,
  "sequence_scope": "task:tsk-codex-fix-99",
  "request_id": "req-codex-sub-003",
  "type": "codex.approval_requested",
  "timestamp": "2026-10-11T22:45:12Z",
  "payload": {
    "approval_id": "appr-cmd-run-8871",
    "task_id": "tsk-codex-fix-99",
    "thread_id": "thr_win_01a0eae5",
    "turn_id": "trn_01a0eae6",
    "item_id": "itm-shell-exec-01",
    "action_type": "command",
    "command_or_path": "pytest tests/test_contracts.py",
    "description": "Execute local unit test suite to verify contract schema validity",
    "expires_at": "2026-10-11T22:50:12Z"
  }
}
